{"candidate":{"generationId":"generation-a","manifestDigest":"sha256:16d92a346bfd2060c2690429b05ef7e682179ca70183b906a91afccb9d97bb46"},"gameId":"fixture-game","generationId":"generation-a","healthOutcome":"pass","kind":"activate-generation","layers":[{"digest":"sha256:301ce5b1642d441cae33b6161b6e7ee1b1debd70a4b2ee9ff541ebb375bdefbd","licenseId":"LicenseRef-Fixture","mediaType":"application/vnd.alloy.compatibility-fixture","name":"runtime","role":"host-runtime","size":25,"sourceRevision":"main-21136e4","version":"1"},{"digest":"sha256:ecf8e51145715caf1cf9467f4e54603ea036dac7970620016fd618d0e82fe8cf","licenseId":"LicenseRef-Fixture","mediaType":"application/vnd.alloy.compatibility-fixture","name":"profile","role":"profile","size":20,"sourceRevision":"main-21136e4","version":"a"}],"operationId":"fixture-game-generation-a-435124f8-bad3-4dac-8f84-36cdb538cafb","schemaVersion":"1.0","state":"complete"}