{"candidate":{"generationId":"generation-b","manifestDigest":"sha256:c4e71722e1e909c3c89dfda7393df11b37c4be317c1a71ed06c6d9961ced2e43"},"gameId":"fixture-game","generationId":"generation-b","healthOutcome":"pass","kind":"activate-generation","layers":[{"digest":"sha256:301ce5b1642d441cae33b6161b6e7ee1b1debd70a4b2ee9ff541ebb375bdefbd","licenseId":"LicenseRef-Fixture","mediaType":"application/vnd.alloy.compatibility-fixture","name":"runtime","role":"host-runtime","size":25,"sourceRevision":"main-21136e4","version":"1"},{"digest":"sha256:bf1a50cd26f9520733748074dfe711d161e86da66cf5787b3124a2ef8b351435","licenseId":"LicenseRef-Fixture","mediaType":"application/vnd.alloy.compatibility-fixture","name":"profile","role":"profile","size":20,"sourceRevision":"main-21136e4","version":"b"}],"operationId":"fixture-game-generation-b-a2b3bbb6-41aa-4ee8-9ff0-cf5ade5b3c2f","previousActive":{"generationId":"generation-a","manifestDigest":"sha256:16d92a346bfd2060c2690429b05ef7e682179ca70183b906a91afccb9d97bb46"},"schemaVersion":"1.0","state":"complete"}